{
  "schemaVersion": 1,
  "build": 185872,
  "reviewedAt": "2026-10-20",
  "editorialNotice": "本站整理的有条件战术资料；来源交叉核对不等于 DE185872 客户端交战实测。未模拟混编协同、阵型、射程内走位、弹道、范围伤害、误伤、转化、绕后和地形，不提供胜率、固定配比或保证取胜。",
  "sources": [
    {
      "id": "britons-buffer-2022",
      "title": "不列颠弓兵该用什么掩护？",
      "url": "https://steamcommunity.com/app/813780/discussions/0/5154941593375185108/?l=hungarian",
      "publishedAt": "2022-04-18",
      "kind": "玩家讨论",
      "checkedAt": "2026-10-20",
      "note": "已读主帖及全部六条回复；只采纳按敌军和资源选择掩护的思路，不采纳最佳阵容断言与旧数值。"
    },
    {
      "id": "wagon-cannon-2024",
      "title": "受战车保护的火炮为何难以切入？",
      "url": "https://steamcommunity.com/app/813780/discussions/0/4415298919343522251/",
      "publishedAt": "2024-07-06",
      "kind": "玩家讨论",
      "checkedAt": "2026-10-20",
      "note": "已读主帖及第一页；用于确认单车反制不能直接外推整套推进，绝对胜负、平衡评价和旧数值不进入建议。"
    },
    {
      "id": "combined-arms-2023",
      "title": "军队运用：互补编成及其维护代价",
      "url": "https://note.com/fb_shokai/n/n057f2d5aab82",
      "publishedAt": "2023-02-22",
      "kind": "独立战术指南",
      "checkedAt": "2026-10-20",
      "note": "已读正文：主力与补位兵有不同任务；多兵种还增加研究、经济和操作负担。文中的游戏数字未用于本页。"
    },
    {
      "id": "arena-guide-2024",
      "title": "Arena：帝王攻城、地图控制与资源",
      "url": "https://aoe2.guide/arena/",
      "publishedAt": "2024-09-30",
      "kind": "独立战术指南",
      "checkedAt": "2026-10-20",
      "note": "作者 MonsieurBaggins；已读帝王攻城、土耳其路线、地图控制和黄金紧张分支，只用于条件化整理，旧数值和文明强度评级不进入模型。"
    },
    {
      "id": "artillery-discussion-2023",
      "title": "土耳其与波希米亚 Arena 对局中的火炮术思路",
      "url": "https://forums.ageofempires.com/t/a-reminder-how-broken-turks-are-on-arena-and-need-nerfs-here/222904",
      "publishedAt": "2023-01-20",
      "kind": "独立讨论，意见有争议",
      "checkedAt": "2026-10-20",
      "note": "正文提及手推炮、火炮术、苏丹亲兵和翼骑兵分工；未核对所述录像，不采纳胜负或过强结论。"
    },
    {
      "id": "official-185872",
      "title": "官方 Update 185872",
      "url": "https://www.ageofempires.com/news/age-of-empires-ii-definitive-edition-update-185872/",
      "publishedAt": "2026-09-23",
      "kind": "官方补丁",
      "checkedAt": "2026-10-20",
      "note": "已读平衡部分；旧指南与当前补丁有时间差。具体游戏数值和资格由本站固定数据读取。"
    }
  ],
  "scenarios": [
    {
      "id": "britons-archer-cover",
      "title": "不列颠帝王步弓的掩护选择",
      "civs": ["Britons"],
      "age": 4,
      "ownMainUnitIds": [492, 8, 530],
      "enemyCompositions": ["cavalry", "skirmishers", "cavalry-skirmishers"],
      "singleThreatNote": "只见骑兵时，防止贴身是当前任务；只见掷矛手时，要先判断能否接近或提供受保护的攻城火力。",
      "mixedThreatNote": "骑兵加入掷矛手后，长戟兵虽能守接近路线，仍不能解决后方掷矛手；负责清掷矛手的兵也不能脱离防骑保护。",
      "cardIds": ["britons-halb-screen", "britons-light-cav-access", "britons-protected-onager"],
      "notCovered": "其他自方文明、骑射主力、额外攻城或其他敌军组合暂未覆盖；不把缺失观察当成没有掩护。"
    },
    {
      "id": "arena-wagon-cannon",
      "title": "1v1 Arena 帝王战车与火炮推进",
      "civs": ["Turks"],
      "age": 4,
      "ownMainUnitIds": [5, 46, 557],
      "enemyCiv": "Bohemians",
      "enemyMainUnitIds": [1704, 1706],
      "enemyCannonUnitIds": [36, 1709],
      "enemyCompositions": ["wagons", "wagons-cannon", "wagons-cannon-halberdiers"],
      "singleThreatNote": "目前只看到战车，尚未出现后排反攻城威胁。本页先提示继续确认增援和护军，纯战车的完整应对不在首版行动路线内。",
      "mixedThreatNote": "战车后方加入手推炮或榴弹炮后，慢速反战车单位可能先遭反炮；再有长戟兵封住通路时，骑兵也不能直接把单兵相克变成切后排机会。",
      "cardIds": ["turks-protected-artillery", "turks-flank-opening", "turks-reposition"],
      "notCovered": "首版只整理自方土耳其已有步行火药主力的情况。其他文明、团战、非 Arena 或额外僧侣等组合暂未覆盖；不声称这些文明没有解法。"
    }
  ],
  "cards": [
    {
      "id": "britons-halb-screen",
      "scenario": "britons-archer-cover",
      "title": "骑兵正在威胁步弓：用长戟兵守住接近路线",
      "problem": "只增加步弓不能阻止近战骑兵贴身；掩护的任务是限制骑兵接近。",
      "roles": {
        "main": "现有步弓保留射击空间，处理敌方暴露的单位。",
        "cover": "长戟兵守住步弓及己方攻城的接近路线，不追逐整支敌军。",
        "siege": "攻城若在场，留在保护范围内；此卡不判断能否拆下建筑。"
      },
      "conditions": ["已确认敌方有近战骑兵。", "长戟兵形态升级及兵营已具备；当前补兵所需食物、木材可持续。"],
      "unitIds": [359],
      "cost": "需要兵营、形态及相关升级投入，还占用人口、食物和木材；守住路线也会限制推进速度。",
      "counterexample": "骑兵后面加入掷矛手时，掷矛手能继续威胁步弓和长戟兵。长戟兵前排不等于已经解决整个组合。",
      "alternative": "有已确认的侧向接近机会时查看轻型骑兵路线；无法接近掷矛手时查看受保护的中型投石车，条件不足则保留主力并后撤复查。",
      "next": "观察敌方是否加入掷矛手、攻城，或让骑兵绕过前排；这些变化都要求重看掩护任务。",
      "sourceIds": ["britons-buffer-2022", "combined-arms-2023"]
    },
    {
      "id": "britons-light-cav-access",
      "scenario": "britons-archer-cover",
      "title": "掷矛手可以接近：让轻型骑兵承担接触任务",
      "problem": "长戟兵是防骑前排，不能代替清理掷矛手的任务。",
      "roles": {
        "main": "现有步弓支援接触点，不独自跟掷矛手正面对射。",
        "cover": "轻型骑兵接近暴露的掷矛手；敌有骑兵时，防骑掩护仍须留在主力旁。",
        "siege": "此路线不要求新增攻城；已有攻城仍需保护。"
      },
      "conditions": ["已确认有掷矛手，且有无需穿过敌方护军的接近与撤回路线。", "地形允许绕行；马厩和轻型骑兵形态已具备，食物补兵可持续。"],
      "unitIds": [546],
      "cost": "会持续消耗食物并增加分队操作；分兵可能削弱主力保护，接触后也可能需要撤回。",
      "counterexample": "狭窄缺口被护军封住，或敌骑兵仍覆盖接近路线时，不应把轻型骑兵直接送进整个阵容。",
      "alternative": "接近路线不成立但有保护阵地和木金时，查看中型投石车路线；食物吃紧则先保住现有军队，重新查路。",
      "next": "复查护军是否回防、路线是否被堵、己方前排是否因分兵出现缺口。",
      "sourceIds": ["britons-buffer-2022", "combined-arms-2023"]
    },
    {
      "id": "britons-protected-onager",
      "scenario": "britons-archer-cover",
      "title": "掷矛手封住正面：评估受保护的中型投石车",
      "problem": "当轻型骑兵无法安全接近时，可以改变火力任务，而不是继续把近战兵送进缺口。",
      "roles": {
        "main": "步弓支援己方攻城，避免与己方投射区域重叠。",
        "cover": "敌有骑兵时保留防骑掩护，阻止敌军贴近投石车。",
        "siege": "中型投石车威胁成群掷矛手，迫使对手调整阵型；本页不计算范围命中。"
      },
      "conditions": ["已确认敌方有成群掷矛手，没有超出本页收录的敌方攻城。", "攻城武器厂、中型投石车形态及安全射击和撤回位置已具备；木材和黄金可持续。"],
      "unitIds": [550],
      "cost": "新增木金、形态升级、慢速单位和操作负担；需要持续保护，并注意己方范围伤害风险。",
      "counterexample": "没有保护位置，敌骑兵能直接贴近，或出现敌方反攻城火力时，单加投石车可能继续损失高价值单位。",
      "alternative": "侧路重新打开且食物允许时回看轻型骑兵；两条路线都不成立时先换交战位置，不把本卡当作强行接战命令。",
      "next": "观察掷矛手是否分散、敌军是否绕后或转出攻城，以及自己的护军能否跟上。",
      "sourceIds": ["britons-buffer-2022", "combined-arms-2023"]
    },
    {
      "id": "turks-protected-artillery",
      "scenario": "arena-wagon-cannon",
      "title": "火炮仍有护军：保护自己的反炮火力",
      "problem": "能反制单独战车的慢速攻城，可能先被战车后方的手推炮或榴弹炮攻击。需先分清前排与后排威胁。",
      "roles": {
        "main": "现有火枪手或苏丹亲兵支援前线；敌有长戟兵时，优先阻止其无阻挡地接近己方攻城。",
        "cover": "护军保护己方手推炮，不因追赶战车而暴露反炮火力。",
        "siege": "已具备火炮术的手推炮从受保护位置争取攻击敌方火炮的机会；不把射程优势等同于命中或取胜。"
      },
      "conditions": ["已确认战车后有手推炮或榴弹炮，且火炮形态已经辨认。", "土耳其帝王、攻城武器厂及火炮术已具备，有安全射击和撤回位置，木金可支持补充。"],
      "unitIds": [36],
      "techIds": [10, 47],
      "cost": "手推炮与火炮术需要较多资源；生产和重新部署也需要时间，主力必须为攻城留出保护与撤回空间。",
      "counterexample": "仅仅抵达帝王、火炮术尚未完成，或主力无法守住部署位置时，不能把这个方案显示为立即可执行。",
      "alternative": "敌方火炮暴露且侧路已查清时查看翼骑兵切入；没有部署空间时先换位置并保住资源。",
      "next": "复查敌方火炮位置、长戟兵或其他护军的移动，以及己方反炮位置是否即将失守。",
      "sourceIds": ["wagon-cannon-2024", "arena-guide-2024", "artillery-discussion-2023"]
    },
    {
      "id": "turks-flank-opening",
      "scenario": "arena-wagon-cannon",
      "title": "后排暴露且侧路已查清：评估翼骑兵切入",
      "problem": "骑兵切火炮需要接近机会；战车和长戟兵挡路时，单位相克关系不能创造通路。",
      "roles": {
        "main": "已有步行火药主力牵制前线，不因分兵让自己的攻城失去保护。",
        "cover": "翼骑兵只利用已经确认的空当接近后排；不负责正面穿过战车与长戟兵。",
        "siege": "若已有己方手推炮，保留其反炮职责，避免跟随分队前冲。"
      },
      "conditions": ["敌方手推炮或榴弹炮确实暴露；侧路、到场和撤回均已确认可用。", "地形允许侧向接近，马厩已具备，食物能够持续补兵；土耳其已到帝王。"],
      "unitIds": [441],
      "cost": "持续消耗食物、人口和分队操作；分兵期间主力可能少一层掩护，切入失败会损失机动兵。",
      "counterexample": "护军仍控制通路、只能经过狭窄正面，或侧路只是没有侦察过时，不显示可以直接切炮。",
      "alternative": "空当不成立则查看保护反炮火力；没有资源维持正面时先重新部署，不靠重复正面冲锋解决。",
      "next": "观察长戟兵是否回头、火炮是否退回战车后、侧路是否被封，以及主力是否仍能保住原位置。",
      "sourceIds": ["wagon-cannon-2024", "combined-arms-2023", "arena-guide-2024"]
    },
    {
      "id": "turks-reposition",
      "scenario": "arena-wagon-cannon",
      "title": "正面条件不足：先重查位置、资源和侧翼",
      "problem": "持续补单一克制兵，可能只是继续送进受保护的推进阵容；可以改变交战地点和目标。",
      "roles": {
        "main": "保留现有主力，评估退到能保护补兵和资源的位置。",
        "cover": "机动分队只在通路已确认时牵制暴露的经济或补给方向；不从未知侧路自动推导可以骚扰。",
        "siege": "珍惜现有攻城；撤回和重新部署有时间代价，不要求在失去保护的位置继续换炮。"
      },
      "conditions": ["正面部署、侧向切入或持续资源至少一项尚不具备。", "先确认能否撤回以及新位置能否维持资源；未知时仅列出补查项。"],
      "unitIds": [],
      "cost": "可能让出建筑、地图空间或外部资源；转移也会中断采集和补兵，不能把后撤当作没有代价。",
      "counterexample": "退路或替代资源已被封锁，或分兵会立即丢失关键区域时，不能机械套用后撤与骚扰。",
      "alternative": "找到可保护的射击点后回看反炮；确认后排空当后回看侧切。若仍未知，先补观察而不指定胜利路线。",
      "next": "查看安全退路、替代资源、敌军新增护军及侧路是否真的暴露；未来对局也可另查更早施压的时机，本页不提供开局步骤。",
      "sourceIds": ["wagon-cannon-2024", "arena-guide-2024", "combined-arms-2023"]
    }
  ],
  "prerequisiteUnitIds": [
    74, 75, 77, 473, 567, 93, 358, 359, 751, 753, 752, 448, 546, 441, 38, 283, 569, 329, 330, 207, 4, 24, 492, 7, 6, 39, 474, 1258, 422, 548, 280, 550, 588,
    279, 542, 125, 5, 36, 331, 8, 530, 46, 557
  ],
  "requiredUnlocks": {
    "5": [47],
    "36": [47]
  },
  "unlockScopeNote": "只声明本页审计的火枪手、手推炮必要化学解锁；不把原始启用指令全当作强制前置。"
}
